<?xml version="1.0" ?>
<!ELEMENT Upses (Model+)>
<!ATTLIST Upses count NMTOKEN #REQUIRED>
<!ELEMENT Model (ManufactNameList, ModelNameList, DriverName,DriverNoLock?,DriverMaxStartDelay?,ParamDefList?,Desc?)>
<!ATTLIST Model pref NMTOKEN #REQUIRED>
<!ELEMENT ManufactNameList (ManufactName+)>
<!ELEMENT ManufactName EMPTY>
<!ATTLIST ManufactName value CDATA #REQUIRED>
<!ELEMENT ModelNameList (ModelName+)>
<!ELEMENT ModelName EMPTY>
<!ATTLIST ModelName value CDATA #REQUIRED>
<!ELEMENT DriverName EMPTY>
<!ATTLIST DriverName name CDATA #REQUIRED>
<!ATTLIST DriverName port ( serial | usb ) #REQUIRED>
<!ELEMENT DriverNoLock EMPTY>
<!ELEMENT DriverMaxStartDelay EMPTY>
<!ATTLIST DriverMaxStartDelay value NMTOKEN #REQUIRED>
<!ELEMENT ParamDefList (paramDef+)>
<!ELEMENT ParamDef EMPTY>
<!ATTLIST ParamDef name NMTOKEN #REQUIRED>
<!ATTLIST ParamDef value CDATA #REQUIRED>
<!ELEMENT Description (#PCDATA)
